{
  "sessionId": "session-001",
  "txnId": "txn-place-0001",
  "tickId": 42,
  "commandId": "cmd-0001",
  "predictionKey": "prediction-0001",
  "state": "Committed",
  "expectedGameRevision": 17,
  "expectedVoxelRevision": 23,
  "chunkRevisionSet": { "chunk-0-0": 8 },
  "deadlineTick": 50,
  "preparedGameDelta": { "player-1": { "availableBlocks": 9 } },
  "preparedVoxelToken": "voxel-reservation-0001",
  "commitOrder": ["VoxelCommit", "EcsCommandBufferCommit"],
  "commitIntentPersisted": true,
  "participantMarkers": { "voxelCommit": true, "ecsCommandBufferCommit": true },
  "observedGameRevision": 17,
  "observedVoxelRevision": 23,
  "resultRevisionVector": {
    "tickId": 42,
    "gameRevision": 18,
    "voxelWorldRevision": 24,
    "chunkRevisionSet": { "chunk-0-0": 9 },
    "replicationRevision": 13,
    "configRevision": 4,
    "schemaEpoch": 1
  }
}
