{
  "sessionId": "session-001",
  "txnId": "txn-place-0002",
  "tickId": 43,
  "commandId": "cmd-0002",
  "predictionKey": "prediction-0002",
  "state": "Aborted",
  "expectedGameRevision": 18,
  "expectedVoxelRevision": 24,
  "chunkRevisionSet": { "chunk-0-0": 9 },
  "deadlineTick": 52,
  "preparedGameDelta": null,
  "preparedVoxelToken": null,
  "commitOrder": ["VoxelCommit", "EcsCommandBufferCommit"],
  "commitIntentPersisted": false,
  "participantMarkers": { "voxelCommit": false, "ecsCommandBufferCommit": false },
  "observedGameRevision": 19,
  "observedVoxelRevision": 24,
  "abortReason": "RevisionConflict",
  "resultRevisionVector": null
}
